ticker,date,time,title
GSK,May-20-22,09:25AM,"Zacks Industry Outlook Highlights Eli Lilly, Novo Nordisk, Merck, and Glaxo"
GSK,May-19-22,05:08PM,"Top Analyst Reports for Apple, Berkshire Hathaway, & S&P Global"
GSK,May-19-22,09:32AM,4 Large Drug Stocks to Watch as the Industry Recovers
GSK,May-18-22,03:05PM,AstraZeneca (AZN) Inks Deal to Develop COVID-19 Antibodies
GSK,May-17-22,11:30AM,Gilead (GILD) HIV Studies Removed From FDA's Clinical Hold
GSK,May-14-22,10:00AM,Was This Acquisition a Smart Move for GlaxoSmithKline?
GSK,May-07-22,07:57AM,Why GSK May Have Bet Too Big on a Pandemic Pipeline
GSK,May-04-22,09:30AM,Voltaren Teams Up with Actress Jennie Garth to Support Caregivers Nationwide
GSK,May-02-22,03:19PM,MOBI Makes Their Post-Pandemic NYC Debut
GSK,May-02-22,12:45PM,Swiss scientist convicted of conspiring to steal GlaxoSmithKline trade secrets
GSK,May-02-22,10:17AM,Biotech Stocks Are Still Falling. The Near-Term Outlook Is Grim.
GSK,Apr-29-22,11:05AM,Gilead (GILD) Q1 Earnings Beat on Solid COVID Treatment Sales
GSK,Apr-28-22,06:17AM,"Eli Lilly Gains On Earnings Beat, COVID-19 Antibodies Revenue Jumps"
GSK,Apr-27-22,03:34PM,"GlaxoSmithKline Clocks 32% Topline Growth Buoyed By COVID-19 Therapy, Shingrix Vaccine"
GSK,Apr-27-22,03:19PM,These 10 Stocks Are Soaring Today
GSK,Apr-27-22,11:10AM,"Glaxo's (GSK) Q1 Earnings Top, Xevudy Adds $1.7B in Sales"
GSK,Apr-27-22,08:48AM,GlaxoSmithKline Beats Expectations Boosted by  Covid-19 Treatment. The Stock Is Up.
GSK,Apr-27-22,07:22AM,GSK share price rises on COVID treatment boost
GSK,Apr-27-22,04:55AM,GlaxoSmithKline Beats Expectations Boosted by  Covid-19 Treatment. The Stock Is Up.
GSK,Apr-27-22,04:14AM,GSK beats forecasts on back of Covid and shingles treatments
GSK,Apr-27-22,04:12AM,Glaxo beats expectations with boost from Covid treatment
GSK,Apr-27-22,03:11AM,"GlaxoSmithKline earnings, revenue beat expectations"
GSK,Apr-27-22,02:38AM,Lloyds Boosts Outlook Despite Inflation Warning: The London Rush
GSK,Apr-26-22,11:44AM,"Drug/Biotech Stocks' Apr 27 Q1 Earnings Roster: GSK, AMGN & More"
GSK,Apr-25-22,09:02AM,Glaxo (GSK) to Report Q1 Earnings: What's in the Cards?
GSK,Apr-22-22,09:56AM,"Pharma Stock Roundup: J&J's Mixed Q1 Results, FDA Updates for GSK and AZN"
GSK,Apr-21-22,05:45PM,GlaxoSmithKline (GSK) Stock Moves -0.33%: What You Should Know
GSK,Apr-21-22,08:44AM,"UPDATE 1-CureVac, GSK's experimental COVID variant vaccine effective in mice -study"
GSK,Apr-20-22,08:23AM,Glaxo's (GSK) NDA for Daprodustat Gets Accepted by the FDA
GSK,Apr-20-22,07:51AM,GSK workers vote to strike over below inflation pay rise
GSK,Apr-19-22,05:50PM,GlaxoSmithKline (GSK) Stock Sinks As Market Gains: What You Should Know
GSK,Apr-18-22,12:12PM,Regeneron (REGN) REGEN-COV BLA Review Extended by 3 Months
GSK,Apr-18-22,10:55AM,Merck's (MRK) Pneumococcal Jab Gets FDA's Breakthrough Tag
GSK,Apr-14-22,01:34PM,"Biotech Stock Roundup: SRRA Surges on GSK Buyout, HALO Offers Update & More"
GSK,Apr-14-22,10:06AM,Halozyme (HALO) to Acquire Antares for Auto Injector Platform
GSK,Apr-14-22,10:03AM,M&As in Spotlight With GSK Announcement: 3 Biotechs in Focus
GSK,Apr-14-22,07:08AM,Here's What This Regulatory News Could Mean for GlaxoSmithKline
GSK,Apr-13-22,05:45PM,GlaxoSmithKline (GSK) Gains But Lags Market: What You Should Know
GSK,Apr-13-22,04:16PM,"Biotech Feeding Spree As GSK, Halozyme Announce Nearly $3 Billion In Deals"
GSK,Apr-13-22,11:52AM,TBJ Plus: Cary gets new golf tournament; PPD Wilmington headquarters for sale; NC voters want legal weed
GSK,Apr-13-22,11:42AM,Why Is Sierra Oncology (SRRA) Stock Up Today?
GSK,Apr-13-22,10:31AM,GlaxoSmithKline to buy San Mateo-based Sierra Oncology for $1.9B
GSK,Apr-13-22,10:28AM,GlaxoSmithKline to buy California biotech firm Sierra Oncology for $1.9B
GSK,Apr-13-22,10:18AM,"Glaxo (GSK) to Buy Sierra for $1.9B, Add Hematology Drug"
GSK,Apr-13-22,09:40AM,Sierra Oncology Stock Soars After $1.9 Billion Takeover by Glaxo
GSK,Apr-13-22,09:09AM,10 Biotech Stocks to Buy Today According to Ken Fisher
GSK,Apr-13-22,08:32AM,GSK to buy Sierra Oncology for $1.9 billion
GSK,Apr-13-22,08:14AM,Why Sierra Oncology Stock Is Soaring Today
GSK,Apr-13-22,07:52AM,GlaxoSmithKline Scoops Up Rare Cancer-Focused Sierra Oncology In $1.9B Cash Deal
GSK,Apr-13-22,04:44AM,GlaxoSmithKline to buy Sierra Oncology for £1.5bn to boost cancer drug pipeline
GSK,Apr-13-22,04:21AM,Sierra Oncology Stock Soars After $1.9 Billion Takeover by GlaxoSmithKline
GSK,Apr-13-22,02:48AM,UPDATE 3-GSK to buy Sierra Oncology amid pressure to boost drug pipeline
GSK,Apr-13-22,02:27AM,GlaxoSmithKline to Acquire Sierra Oncology for $1.9 Bln
GSK,Apr-13-22,02:21AM,GSK to buy Sierra Oncology amid pressure to boost drug pipeline
GSK,Apr-12-22,11:20AM,Gilead (GILD) Magrolimab Studies' Partial Clinical Hold Removed
GSK,Apr-11-22,04:42PM,Highly Rated GlaxoSmithKline Eyes Breakout After Racking Up Series Of Wins
GSK,Apr-11-22,08:01AM,"CureVac, GSK ink 'pandemic preparedness' agreement through 2029 with German government"
GSK,Apr-08-22,09:31AM,Antibody Treatments for COVD-19 Face Challenges in the U.S.
GSK,Apr-07-22,05:50PM,GlaxoSmithKline (GSK) Outpaces Stock Market Gains: What You Should Know
GSK,Apr-07-22,10:06AM,"Novartis CEO Continues His Shake-Up, Says It Will Save More Than $1 Billion Annually"
GSK,Apr-07-22,08:53AM,"Novartis CEO Continues His Shake-Up, Says It Will Save More Than $1 Billion Annually"
GSK,Apr-07-22,06:21AM,Carrefour Seen as Europes Top M&A Target in Bloomberg Poll
GSK,Apr-06-22,12:25PM,VIR Stock Down on Another Setback for COVID-19 Antibody
GSK,Apr-06-22,10:46AM,Glaxo to Curb Drugstore Staples in Russia as It Walks Ethical Tightrope
GSK,Apr-06-22,10:13AM,"UPDATE 2-British drugmaker GSK stops supplement, vitamin sales to Russia"
GSK,Apr-06-22,10:00AM,New Large-Scale Observational Study Shows COVID-19 Could Create Vulnerability to Shingles for People Age 50+
GSK,Apr-06-22,09:35AM,"CORRECTED-GSK stops sales of supplement, vitamin to Russia"
GSK,Apr-06-22,06:28AM,Coronavirus tally: FDA pulls Glaxo COVID treatment ahead of panel meeting on next steps for 2022
GSK,Apr-05-22,05:58PM,"FDA pulls approval for Vir Covid drug, sending stock plunging"
GSK,Apr-05-22,04:40PM,FDA pulls GlaxoSmithKlines COVID-19 drug as omicron subvariant dominates U.S. cases
GSK,Apr-05-22,11:26AM,FTSE 100 shareholders in line to get a £114bn total cash return in 2022
GSK,Apr-04-22,05:56PM,U.S. rolls back use of Vir's drug against new Covid variant
GSK,Apr-01-22,09:00PM,3 CEOs to Invest In
GSK,Apr-01-22,09:09AM,"Pharma Stock Roundup: FDA Nod for 2nd COVID Booster, New Approvals for AZN, GSK, NVS"
GSK,Mar-31-22,05:45PM,GlaxoSmithKline (GSK) Stock Moves -0.32%: What You Should Know
GSK,Mar-31-22,11:23AM,VIR Stock Gains on News of Inclusion in the S&P SmallCap 600
GSK,Mar-31-22,06:00AM,The Petri Dish: Adagio says its antibody works against omicron now
GSK,Mar-30-22,04:26PM,Vir Soars As Its Addition To SmallCap 600 Helps Wipe Out Recent Covid Volatility
GSK,Mar-30-22,12:28PM,"J&J (JNJ) Gets FDA Nod for HIV Jab, Cabenuva, in Adolescents"
GSK,Mar-30-22,10:09AM,CureVac and Glaxo Begin Testing New Second Generation Covid-19 Vaccine
GSK,Mar-30-22,09:33AM,"Adagio Stock Spikes on New Data, but Its Omicron Problems Remain"
GSK,Mar-28-22,12:41PM,The BA.2 Covid Variant Is Already Changing the U.S. Response to the Pandemic
GSK,Mar-28-22,12:31PM,AstraZeneca (AZN) Gets EU Nod for COVID-19 Antibody Cocktail
GSK,Mar-28-22,11:41AM,FDA Revises EUA of Glaxo (GSK) & Vir's (VIR) COVID Therapy
GSK,Mar-28-22,10:39AM,FDA Says Current Dose Of GSK-Vir's COVID-19 Therapy Unlikely To Work Against Omicron Subvariant
GSK,Mar-28-22,09:57AM,BA.2 Is Already Changing the U.S. Response to the Pandemic
GSK,Mar-25-22,05:45PM,GlaxoSmithKline (GSK) Stock Sinks As Market Gains: What You Should Know
GSK,Mar-25-22,04:46PM,UPDATE 2-FDA says current dose of GSK-Vir COVID therapy unlikely to work against BA.2 variant
GSK,Mar-25-22,04:04PM,US Food and Drug Administration Revises Emergency Use Authorization for Sotrovimab Due to Omicron BA.2 Subvariant
GSK,Mar-25-22,11:03AM,Pfizer's (PFE) RSV Jab Gets Another Breakthrough Therapy Tag
GSK,Mar-25-22,09:47AM,Halozyme (HALO) Inks Collaboration Deal With Chugai Pharma
GSK,Mar-25-22,09:00AM,Where to Invest $100 Right Now
GSK,Mar-24-22,05:50PM,GlaxoSmithKline (GSK) Gains But Lags Market: What You Should Know
GSK,Mar-24-22,06:22AM,"The Petri Dish: Alexion settles patent dispute, another Covid company launches"
GSK,Mar-23-22,01:03PM,"LifeMine Therapeutics, GSK Ink $70M Drug Discovery, Development Pact"
GSK,Mar-23-22,06:30AM,"With $175M, GSK partnership, LifeMine eyes fungi as future of drugmaking"
GSK,Mar-18-22,05:45PM,GlaxoSmithKline (GSK) Stock Sinks As Market Gains: What You Should Know
GSK,Mar-17-22,01:15PM,"AstraZeneca, Merck's Lynparza Cut Risk of Breast Cancer Death"
GSK,Mar-17-22,05:36AM,"GSK to supply essential medicines to Russia, halt clinical trials"
GSK,Mar-17-22,04:20AM,GSK Consumer Healthcare -- Moody's assigns first time Baa1 ratings to GSK Consumer (aka Haleon); stable outlook
TSCO,May-20-22,08:46AM,"BJ's Wholesale Club (BJ) Q1 Earnings Beat, Comps Rise Y/Y"
TSCO,May-20-22,08:16AM,Why Tractor Supply Stock Fell 11% This Week
TSCO,May-18-22,12:53PM,"Why Dollar Tree, Tractor Supply, and BJ's Wholesale Club Stocks All Fell Today"
TSCO,May-18-22,11:11AM,Tractor Supplys Spring Paper Clover Program Raises Nearly $1.3 Million For 4-H
TSCO,May-18-22,10:46AM,"Target's (TGT) Q1 Earnings Miss Estimates, Margins Hit Hard"
TSCO,May-11-22,10:00AM,Tractor Supply Company Declares Quarterly Dividend
TSCO,May-11-22,09:55AM,Tractor Supply (TSCO) Forms 'Hammer Chart Pattern': Time for Bottom Fishing?
TSCO,May-11-22,07:10AM,"Grocery Outlet (GO) Beats on Q1 Earnings, Raises FY22 Guidance"
TSCO,May-10-22,10:43AM,Here's Why Tractor Supply (TSCO) is Marching Ahead of Industry
TSCO,May-10-22,08:01AM,"Zacks Industry Outlook Highlights Tractor Supply, MarineMax, and Build-A-Bear Workshop"
TSCO,May-09-22,09:49AM,3 Retail-Miscellaneous Stocks Braving Industry-Wide Challenges
TSCO,May-08-22,08:15AM,Why Tractor Supply Company Declined 13.7% in April
TSCO,May-05-22,10:56AM,"Central Garden & Pet (CENT) Q2 Earnings Beat, Sales Up Y/Y"
TSCO,May-05-22,10:52AM,"Sprouts Farmers (SFM) Q1 Earnings Beat, Sales Increase Y/Y"
TSCO,Apr-28-22,11:40AM,DKS or TSCO: Which Is the Better Value Stock Right Now?
TSCO,Apr-27-22,04:02PM,Tractor Supply Kicks Off Spring Paper Clover Campaign in Support of 4-H Youth
TSCO,Apr-27-22,10:12AM,Tractor Supply Company Named to Forbes List of Best Employers for Diversity 2022
TSCO,Apr-25-22,12:44PM,What Type Of Shareholders Own The Most Number of Tractor Supply Company (NASDAQ:TSCO) Shares?
TSCO,Apr-25-22,10:58AM,11 Stocks Catching Investors Eyes After Earnings Reports
TSCO,Apr-22-22,12:45PM,Here is Why Growth Investors Should Buy Tractor Supply (TSCO) Now
TSCO,Apr-21-22,10:56AM,Tractor Supply (TSCO) Q1 Earnings & Sales Beat on Solid Demand
TSCO,Apr-21-22,09:40AM,Tractor Supply Q1 Earnings Exceed Expectations; Reiterates FY22 Outlook
TSCO,Apr-21-22,09:12AM,Kroger (KR) Hiring Staff for Grocery Delivery in South Florida
TSCO,Apr-21-22,08:15AM,Tractor Supply (TSCO) Tops Q1 Earnings and Revenue Estimates
TSCO,Apr-21-22,07:30AM,"Tractor Supply beats on earnings, offers sales guidance below expectations"
TSCO,Apr-21-22,06:55AM,Tractor Supply Company Reports First Quarter 2022 Financial Results; Reiterates 2022 Financial Outlook
TSCO,Apr-20-22,08:40AM,Is a Surprise Coming for Tractor Supply (TSCO) This Earnings Season?
TSCO,Apr-19-22,11:00AM,Tractor Supply Commemorates Earth Week With the Release of 2021 Sustainability Report and Establishes New Water Conservation Goal
TSCO,Apr-19-22,09:42AM,BJ's Wholesale Club (BJ) Digitization Efforts Fuel Sales
TSCO,Apr-19-22,09:34AM,Tractor Supply (TSCO) Lined Up for Q1 Earnings: Factors to Note
TSCO,Apr-19-22,08:19AM,"Home Depot, Lowes, and Other Stocks That Can Keep ClimbingEven If the Housing Market Slows"
TSCO,Apr-19-22,07:30AM,"The Zacks Analyst Blog Highlights J.B. Hunt Transport, Halliburton, Tractor Supply, Pool and Watsco"
TSCO,Apr-19-22,02:15AM,The Housing Market May Be Slowing. But These Four Home Improvement Stocks Are Buying Opportunities.
TSCO,Apr-18-22,04:37PM,"3 Top S&P 500 Stock Market Gainers Today: Twitter Soars As Schwab, Moderna Tumble"
TSCO,Apr-18-22,02:08PM,Here's Why Casey's (CASY) is Staying Ahead of the Curve
TSCO,Apr-18-22,06:24AM,5 Large-Cap Stocks to Buy Ahead of Q1 Earnings This Week
TSCO,Apr-14-22,03:00PM,Tractor Supply (TSCO) Expected to Beat Earnings Estimates: What to Know Ahead of Q1 Release
TSCO,Apr-14-22,02:42PM,Costco (COST) Raises Dividend: What Else You Should Know
TSCO,Apr-13-22,10:34AM,"Albertsons (ACI) Q4 Earnings Beat, Identical Sales Rise 7.5%"
TSCO,Apr-12-22,01:38PM,"Tractor Supply Brings Innovative Tool Engineering ""Out Here"" With Dremel and Bosch Power Tools"
TSCO,Apr-12-22,11:40AM,DKS vs. TSCO: Which Stock Should Value Investors Buy Now?
TSCO,Apr-12-22,11:01AM,Factors Likely to Decide Rite Aid's (RAD) Fate in Q4 Earnings
TSCO,Apr-12-22,10:34AM,"Five Below (FIVE) Rides on Solid Product Range, Store Plans"
TSCO,Apr-12-22,09:45AM,Sally Beauty (SBH) Poised on Growth Pillars & Online Sales
TSCO,Apr-11-22,12:07PM,Factors Influencing Bed Bath & Beyond (BBBY) in Q4 Earnings
TSCO,Apr-11-22,11:38AM,Dollar General (DG) Gains Market Share on Operational Strength
TSCO,Apr-08-22,10:39AM,"Walmart (WMT) Hikes Drivers' Pay, Reveals Fleet Development Plan"
TSCO,Apr-08-22,04:55AM,U.K. Joining Salaries Rising at the Fastest Rate Since 1997
TSCO,Apr-07-22,11:17AM,Costco's (COST) Stellar Sales & Comps Run Continue in March
TSCO,Apr-07-22,09:00AM,Tractor Supply Celebrates Earth Day With In-Store Arrival of Greenworks Pro 60V Lineup
TSCO,Apr-06-22,11:00PM,Supermarkets braced for a cost of living bunfight
TSCO,Apr-06-22,12:10PM,Can Tractor Supply (TSCO) Keep the Earnings Surprise Streak Alive?
TSCO,Apr-05-22,09:00AM,Tractor Supply Announces Upcoming Investor Events
TSCO,Apr-04-22,10:02AM,"Albertsons' (ACI) Omnichannel, Digitization Efforts Fuel Sales"
TSCO,Apr-01-22,02:31PM,Tractor Supply (TSCO) Up 33.8% in a Year: More Room to Rally?
TSCO,Apr-01-22,11:42AM,Sprouts Farmers (SFM) Marches Ahead of Industry: Here's Why
TSCO,Apr-01-22,09:15AM,"Tractor Supply (TSCO) Soars to 52-Week High, Time to Cash Out?"
TSCO,Mar-31-22,05:48PM,Should You Be Adding Tractor Supply (NASDAQ:TSCO) To Your Watchlist Today?
TSCO,Mar-31-22,04:24PM,IBD Stock Of The Day: Tractor Supply Tries To Break Out After Pandemic Drives Growth
TSCO,Mar-30-22,12:16PM,Chewy (CHWY) Tumbles 14% on Wider-Than-Expected Q4 Loss
TSCO,Mar-30-22,10:38AM,"Tractor Supply Donates $50,000 to the Texas Department of Agriculture Star Fund"
TSCO,Mar-29-22,05:50PM,Tractor Supply (TSCO) Gains But Lags Market: What You Should Know
TSCO,Mar-28-22,06:00PM,Tractor Supply (TSCO) Gains But Lags Market: What You Should Know
TSCO,Mar-25-22,11:40AM,ITOCY vs. TSCO: Which Stock Is the Better Value Option?
TSCO,Mar-24-22,01:54PM,"Titan Machinery (TITN) Q4 Earnings Beat Estimates, Surge Y/Y"
TSCO,Mar-24-22,09:42AM,"Ollie's Bargain (OLLI) Q4 Earnings Beat, Comps Down Y/Y"
TSCO,Mar-23-22,10:09AM,Pick Kroger (KR) as You Revisit Your Portfolio Amid Volatility
TSCO,Mar-22-22,05:50PM,Tractor Supply (TSCO) Gains But Lags Market: What You Should Know
TSCO,Mar-22-22,08:30AM,"If You Invested $1000 in Tractor Supply a Decade Ago, This is How Much It'd Be Worth Now"
TSCO,Mar-21-22,12:34PM,BJ's Wholesale Club (BJ) Marching Ahead of Industry: Here's Why
TSCO,Mar-21-22,11:11AM,Ulta Beauty Has the Best Loyalty Program. Heres Why.
TSCO,Mar-20-22,08:00AM,This Agricultural and Garden Supply Company Is a Perennial
TSCO,Mar-19-22,01:16PM,10 Recession-Proof Stocks to Buy and Hold
TSCO,Mar-18-22,12:00PM,Here's Why Tractor Supply (TSCO) is a Great Momentum Stock to Buy
TSCO,Mar-17-22,01:05PM,"Tractor Supply Co. Foundation, Friends of Franklin Parks Renew Harlinsdale Arena Sponsorship"
TSCO,Mar-17-22,11:04AM,"Dollar General (DG) Q4 Earnings Beat, Sales Increase Y/Y"
TSCO,Mar-16-22,05:50PM,Tractor Supply (TSCO) Stock Sinks As Market Gains: What You Should Know
TSCO,Mar-16-22,11:51AM,Add Target (TGT) as You Reshuffle Your Portfolio for 2022
TSCO,Mar-16-22,11:49AM,Here's Why Albertsons (ACI) is Marching Ahead of Industry
TSCO,Mar-16-22,10:48AM,Tractor Supply Helps Neighbors Club Members Build a Better Backyard
TSCO,Mar-16-22,09:14AM,"Walmart (WMT) Expands Global Tech Hubs, Adds Tech Jobs"
TSCO,Mar-16-22,08:01AM,Here's Why it is Apt to Own Tractor Supply (TSCO) Stock Now
TSCO,Mar-15-22,02:11PM,Capri Holdings (CPRI) Gains Market Share on Brand Strength
TSCO,Mar-15-22,10:24AM,Nordstrom (JWN) Rises 20.9% in 3 Months: Is More Upside Left?
TSCO,Mar-15-22,08:07AM,Sally Beauty (SBH) Benefits From Online Sales & Buyouts
TSCO,Mar-14-22,02:42PM,Amazon's (AMZN) Solid Export Momentum Boosts India Prospects
TSCO,Mar-14-22,10:57AM,Costco's (COST) Decent Sales & Comps Trend Drives the Stock
TSCO,Mar-11-22,09:40AM,"Ulta Beauty (ULTA) Q4 Earnings Beat Estimates, Sales Rise"
TSCO,Mar-10-22,05:50PM,Tractor Supply (TSCO) Gains As Market Dips: What You Should Know
TSCO,Mar-10-22,10:00AM,"The Children's Place (PLCE) Q4 Earnings Beat, Comps Up Y/Y"
TSCO,Mar-10-22,10:00AM,"Tractor Supply Reaches Grants for Growing Milestone, Raises $1,129,653"
TSCO,Mar-09-22,11:40AM,ITOCY or TSCO: Which Is the Better Value Stock Right Now?
TSCO,Mar-09-22,10:29AM,"Casey's (CASY) Q3 Earnings Top Estimates, Revenues Up Y/Y"
TSCO,Mar-09-22,10:07AM,"Miranda Lamberts MuttNation & Tractor Supply Co. Donate Over $250,000 to Animal Shelters"
TSCO,Mar-09-22,10:00AM,DICK'S Sporting (DKS) Q4 Earnings & Sales Beat on High Demand
TSCO,Mar-09-22,09:43AM,Amazon (AMZN) Deepens Focus on India With New Storefront
TSCO,Mar-09-22,09:11AM,Walmart's (WMT) New Fulfillment Center to Boost E-commerce
TSCO,Mar-08-22,12:45PM,3 Reasons Growth Investors Will Love Tractor Supply (TSCO)
TSCO,Mar-08-22,08:49AM,"Zacks.com featured highlights include J.B. Hunt Transport Services, Archer-Daniels-Midland, NVIDIA, Tractor Supply and AmerisourceBergen"
TSCO,Mar-07-22,05:57PM,"Hibbett (HIBB) Q4 Earnings and Sales In Line, Comps Dip 1%"
